{
  "version": "audio-chat.v1",
  "user_id": "user-browser-glass-001",
  "session_id": "dev-browser-glass-001",
  "stream_id": "stream_rgb_001",
  "stream_type": "sensor.rgb",
  "seq": 0,
  "timestamp_ms": 1760000000900,
  "codec": "jpeg",
  "sample_rate": 1,
  "channels": 1,
  "duration_ms": 0,
  "payload_size": 3,
  "final": true,
  "metadata": {
    "request_id": "req_rgb_001"
  }
}
